{
  "id": "caramel-workshop",
  "name": "焦糖工坊",
  "version": 1,
  "tags": ["hazard", "industrial", "control"],
  "description": "生产焦糖机关的甜点工坊，障碍和地面危险更频繁。",
  "size": {
    "width": 2300,
    "height": 1700
  },
  "bounds": {
    "type": "rectangle"
  },
  "spawn_rules": {
    "mode": "around_player",
    "min_distance": 350,
    "max_distance": 560
  },
  "hazards": [
    {
      "type": "caramel_spill",
      "description": "焦糖溢流会形成路线压力，首版仅作为地图语义标记。"
    }
  ],
  "visual_description": "金棕焦糖锅炉、饼干齿轮、糖浆管线和亮面地板。",
  "music_theme": "sticky_factory_groove"
}
